{
  "schema_version": 1,
  "level": "L2",
  "updated": "2026-10-29 10:35 北京时间",
  "note": "事实简讯。已经出现在信息精选、实战手册或专题观察里的，不会再出现在这里。",
  "items": [
    {
      "id": "brf-20261029-718a46e93fdd",
      "level": "L2",
      "date": "2026-10-29",
      "time": "10-29 00:07",
      "title": "GitHub Octoverse 2026：过去一年推送 179 亿次，九月逾四成 PR 由智能体起稿",
      "summary": "GitHub 发布 2026 Octoverse：过去 12 个月代码推送 179 亿次，超过 2024 与 2025 之和；合并 PR 增至约 13 亿。官方称截至 9 月，超过 40% 的 PR 由智能体给出初稿（3 月约 17%）；带智能体配置文件的新仓库平均提交量约为无配置仓库的 8 倍。",
      "why": "这是平台级年度体检，用公开遥测把「智能体进日常开发」写成可核对的比例，而不只是个别团队的体感。",
      "affect": "若你带研发团队，可用「四成 PR 智能体起稿」对照自己仓库的 agent 配置与评审节奏；个人开发者不必为报告本身改工具，但值得看清行业默认工作流在往哪偏。",
      "url": "https://github.blog/news-insights/octoverse/octoverse-commits-pushes-reach-new-highs-in-2026-as-developers-build-with-agents",
      "source": "github",
      "lens": "赛道",
      "origin": "archive_seed",
      "candidate_id": "cand-20261029-718a46e93fdd"
    },
    {
      "id": "brf-20261028-2498aaca798f",
      "level": "L2",
      "date": "2026-10-28",
      "time": "10-28 06:20",
      "title": "Anthropic 与美国 GSA 扩 OneGov：联邦到地方政企用 Claude 可享约 40% 折扣",
      "summary": "Anthropic 于北京时间 10 月 28 日凌晨宣布扩大与美国总务管理局（GSA）的 OneGov 协议：联邦、州、地方、部落与领地政府购买 Claude Enterprise、Claude for Government 与 Claude API 可获约 40% 折扣，并称无最低消费门槛。",
      "why": "这是美国公共部门采购 Claude 的价格与覆盖面变化，会影响政企侧部署节奏，但不是面向个人订阅的普惠降价。",
      "affect": "若你不做美国政府或政企采购，本周个人与小团队的模型选型不必因此改换；若你对接美政企客户，可把 OneGov 折扣记进报价对比。",
      "url": "https://www.anthropic.com/news/expanding-partnership-gsa",
      "source": "anthropic",
      "lens": "赛道",
      "origin": "archive_seed",
      "candidate_id": "cand-20261028-2498aaca798f"
    },
    {
      "id": "brf-20261027-5f8e0f8ff8e2",
      "level": "L2",
      "date": "2026-10-27",
      "time": "10-26 22:30",
      "title": "OpenAI 称模型给出 Kakeya 猜想、指数时间假设和量子色动力学结果，并请外部学者核验",
      "summary": "OpenAI 于北京时间 10 月 26 日 22:30 发文，称其模型给出了 Kakeya 猜想、指数时间假设（Exponential Time Hypothesis），以及量子色动力学和相关杨-米尔斯（Yang-Mills）工作的结果，并请外部学者以 shepherd 身份组织核验和后续整理。这些仍是 OpenAI 的主张，尚未经过同行评议；截至现有来源，这些学者没有公开判定对或错。",
      "why": "这三项如果成立，会牵动数学分析、许多以指数时间假设为前提的复杂度结论，以及粒子物理的严格存在性证明。外部核验还在进行，现在不能当成已经证实。",
      "affect": "你若做研究或准备引用，先把它当成 OpenAI 的公开主张，等牵头学者和同行给出对错再引用。本周的产品和模型选型不必因此改换。",
      "url": "https://openai.com/index/building-scientific-understanding-with-academic-communities",
      "source": "openai-blog",
      "lens": "赛道",
      "origin": "archive_seed",
      "candidate_id": "cand-20261026-5f8e0f8ff8e2"
    },
    {
      "id": "brf-20261027-6cd5b6ad40f5",
      "level": "L2",
      "date": "2026-10-27",
      "time": "10-27 08:00",
      "title": "Anthropic 向美国证监会递交招股书，拟纳斯达克代码 ANT",
      "summary": "Anthropic 于 2026-10-26 公开递交 Form S-1，拟发行 A 类普通股并在纳斯达克上市，股票代码拟为 ANT；发行股数与价格区间尚未确定。注册声明尚未生效，当前信息不是出售要约。",
      "why": "这是头部模型公司公开上市流程的关键节点，后续路演、定价与生效时间会影响行业融资与产品节奏预期，但还不等于今天就能买卖股票。",
      "affect": "你若跟踪 Claude 生态或相关供应链：先当事实记下，等生效与定价再谈「能不能买」；本周工具选型不必只因招股书改换。",
      "url": "https://www.anthropic.com/news/s1-sec",
      "source": "anthropicai",
      "lens": "时机",
      "origin": "archive_seed",
      "candidate_id": "cand-20261026-6cd5b6ad40f5"
    },
    {
      "id": "brf-20261026-c5fb22fbf2c4",
      "level": "L2",
      "date": "2026-10-26",
      "time": "10-26 01:04",
      "title": "有人用 Opus 5.5 做出免费三维物理课本《Every Joule》",
      "summary": "创作者 Techartist 用 Anthropic 的 Opus 5.5 与网页三维库 Three.js，做完覆盖英国中学「能量」整章的十课互动课本，可免费在线阅读。",
      "why": "这说明当前顶尖对话模型已经能撑起一门可交互的完整小课，而不只是单页演示。",
      "affect": "你若在评估「模型能不能交付可给外人用的学习/演示成品」，打开原站看完一课后，再决定要不要用同类栈做自己的小课。",
      "url": "https://iamtechartist.com/every-joule/",
      "source": "dotey",
      "lens": "赛道",
      "origin": "archive_seed",
      "candidate_id": "cand-20261026-c5fb22fbf2c4"
    },
    {
      "id": "brf-20261026-7da07aa09f99",
      "level": "L2",
      "date": "2026-10-26",
      "time": "10-26 02:50",
      "title": "独立报告提示 Tailscale SSH 等风险，并提供自查页",
      "summary": "有安全报告称 Tailscale SSH 及相关面存在可被横向利用的问题；作者 levelsio 转发自查站点 Tailworm，方便使用者对照自己的组网与 SSH 设置。",
      "why": "不少个人开发者用 Tailscale 连自己的机器；若开了它的 SSH，需要尽快核对暴露面。",
      "affect": "你正在用 Tailscale SSH 或同类组网，就打开自查页与厂商说明核对；没用到可以忽略。",
      "url": "https://tailworm.com/",
      "source": "levelsio",
      "lens": "时机",
      "origin": "archive_seed",
      "candidate_id": "cand-20261026-7da07aa09f99"
    },
    {
      "id": "brf-20261029-06ceaed31ecf",
      "level": "L2",
      "date": "2026-10-29",
      "time": "10-29 00:09",
      "title": "公开更新：代码仓库",
      "summary": "公开说明里，代码仓库。这句中文说明发生了什么，名字和版本以链接里的原文为准。",
      "why": "它关系到你现在用的工具要不要换，或者能不能继续沿用。",
      "affect": "拿一个你自己的真实任务对照这次变化，再决定换不换。",
      "url": "https://github.blog/news-insights/company-news/github-universe-2026-evolving-every-layer-of-the-stack",
      "source": "github-blog",
      "lens": "工具",
      "origin": "auto_brief",
      "candidate_id": "cand-20261029-06ceaed31ecf"
    },
    {
      "id": "brf-20261028-0bc45ae98810",
      "level": "L2",
      "date": "2026-10-28",
      "time": "10-28 00:12",
      "title": "艾伦人工智能研究所发布 NoveltyBench，检验大模型判断科研想法新不新是否稳定",
      "summary": "艾伦人工智能研究所于北京时间 10 月 28 日凌晨在 Hugging Face 发文，公布基准 NoveltyBench 以及配套数据与代码，用来测试大模型判断一条科研想法是否新颖时，会不会因为提示词或设置不同而给出相反结论。",
      "why": "自动科研流程常把「新不新」交给另一个大模型。文中举例，只改提示词，同一模型在同一批想法上的判断准确率可以从大约 93% 降到大约 41%。",
      "affect": "你若正用大模型给选题打新颖性分数，先读原文再决定信不信这一次结果。不做科研选题，本周不必因此更换模型。",
      "url": "https://huggingface.co/blog/allenai/novelty-bench",
      "source": "huggingface-blog",
      "lens": "赛道",
      "origin": "auto_brief",
      "candidate_id": "cand-20261028-0bc45ae98810"
    },
    {
      "id": "brf-20261024-de27875ea339",
      "level": "L2",
      "date": "2026-10-24",
      "time": "10-24 01:00",
      "title": "OpenAI 说明如何把在线存储扩到服务十亿级用户",
      "summary": "OpenAI 公开了存储扩容的后半：用可靠的多租户、全球缓存和 Azure Cosmos DB，撑住超过十亿 ChatGPT 用户的在线读写。",
      "url": "https://openai.com/index/scaling-storage-one-billion-users-part-two",
      "source": "openai-blog",
      "lens": "赛道",
      "origin": "auto_brief",
      "candidate_id": "cand-20261024-de27875ea339",
      "why": "在线存储怎么扛住十亿级用户，会改变你对这类产品能不能稳住大规模使用的判断。",
      "affect": "你自己的服务也要扩到很大的用户量时，对照这篇里的多租户和缓存做法，再决定要不要改架构。"
    },
    {
      "id": "brf-20261024-58dba56773eb",
      "level": "L2",
      "date": "2026-10-24",
      "time": "10-24 00:15",
      "title": "用文献地图把研究想法收成更具体的问题",
      "summary": "艾伦人工智能研究所介绍 LitPivot：它把文献版图做成可以来回调整的上下文，用来把一个还散的研究想法收成更具体的问题。",
      "url": "https://huggingface.co/blog/allenai/litpivot",
      "source": "huggingface-blog",
      "lens": "工具",
      "origin": "auto_brief",
      "candidate_id": "cand-20261024-58dba56773eb",
      "why": "做文献综述或选题的人，可以看一个问题在现有文献里站在哪，而不是只堆论文。",
      "affect": "手头有一个还散的研究想法时，打开原文看它怎么把文献收成问题；没有选题任务就不必改流程。"
    },
    {
      "id": "brf-20261023-6a4f42571d7f",
      "level": "L2",
      "date": "2026-10-23",
      "time": "10-23 01:21",
      "title": "公开更新：代码仓库",
      "summary": "公开说明里，代码仓库。这句中文说明发生了什么，名字和版本以链接里的原文为准。",
      "why": "它关系到你现在用的工具要不要换，或者能不能继续沿用。",
      "affect": "拿一个你自己的真实任务对照这次变化，再决定换不换。",
      "url": "https://github.blog/security/how-bug-bounty-sharpens-one-researchers-security-skills",
      "source": "github-blog",
      "lens": "工具",
      "origin": "auto_brief",
      "candidate_id": "cand-20261023-6a4f42571d7f"
    },
    {
      "id": "brf-20261023-aec2cbf8823d",
      "level": "L2",
      "date": "2026-10-23",
      "time": "10-23 00:11",
      "title": "艾伦人工智能研究所发布覆盖全球的地表嵌入",
      "summary": "艾伦人工智能研究所发布 OlmoEarth 的新版本，给出覆盖整颗星球的地表嵌入，用来做地球观测和相关分析。",
      "url": "https://huggingface.co/blog/allenai/olmoearth-v1-3",
      "source": "huggingface-blog",
      "lens": "工具",
      "origin": "auto_brief",
      "candidate_id": "cand-20261023-aec2cbf8823d",
      "why": "做遥感、环境或地理数据的人，多了一份可以拿来用的全球地表表示。",
      "affect": "你的任务要用地球观测数据，就打开原文看这版嵌入怎么取；用不上就不必更换现有数据。"
    }
  ]
}
