{
  "schema_version": 1,
  "level": "L2",
  "updated": "2026-10-18 18:30 北京时间",
  "note": "origin=archive_seed 的条目摘自已经公开的归档，不是新事实。origin=auto_brief 由 scripts/derive_briefs.py 从打分自动档写入。实操不从这条管道进站。",
  "items": [
    {
      "id": "brf-20261016-meta-muse-spark-open",
      "level": "L2",
      "date": "2026-10-16",
      "time": "10-16 01:08",
      "title": "Meta 放出可下载的 Muse Spark Open",
      "summary": "816B 总参数、每个词激活 42B 的混合专家模型，权重可以下载，上下文 1M token。官方称是目前最强的美国开放权重模型。演示用两台高配 Mac Studio 跑通，家里的机器别默认能跑。",
      "url": "https://research.meta.ai/blog/muse-spark-open",
      "source": "Meta",
      "lens": "赛道",
      "origin": "archive_seed"
    },
    {
      "id": "brf-20261016-flux3-image-klein",
      "level": "L2",
      "date": "2026-10-16",
      "time": "10-16 00:00",
      "title": "Black Forest Labs 开放 FLUX.3 Image Klein 权重",
      "summary": "蒸馏版默认 16 步，H100 上约 2 秒出 1024 像素的图。支持多张参考图生图，也能在提示词里用边界框控版式。文本编码器换成 Qwen3-VL，另附 FP8 和 NVFP4 单文件权重。",
      "url": "https://huggingface.co/blog/flux-3",
      "source": "HuggingFace",
      "lens": "工具",
      "origin": "archive_seed"
    },
    {
      "id": "brf-20261014-gemini-4-argon",
      "level": "L2",
      "date": "2026-10-14",
      "time": "10-14 00:00",
      "title": "Google 向全球开放 Gemini 4 Argon",
      "summary": "输入输出上限都是 1M token。导入价每百万 token 输入 2 美元、输出 10 美元，缓存命中便宜约 95%。2026 年 11 月 30 日后涨到输入 4 美元、输出 20 美元。",
      "url": "https://blog.google/innovation-and-ai/models-and-research/gemini-models/introducing-gemini-4-argon/",
      "source": "Google",
      "lens": "赛道",
      "origin": "archive_seed"
    },
    {
      "id": "brf-20261014-fish-drama-3",
      "level": "L2",
      "date": "2026-10-14",
      "time": "10-14 02:55",
      "title": "Fish Audio 开放 Drama 3 权重",
      "summary": "Artificial Analysis 把 Drama 3 Preview 列为开源权重 TTS 榜首，发音鲁棒性 93.2% 领先 Eleven v4。年营收低于约 50 万美元可免费商用自托管，自托管要约 18GB 显存。",
      "url": "https://fish.audio/blog/fish-audio-drama-3/",
      "source": "FishAudio",
      "lens": "工具",
      "origin": "archive_seed"
    },
    {
      "id": "brf-20261014-anthropic-scion",
      "level": "L2",
      "date": "2026-10-14",
      "time": "10-14 00:36",
      "title": "Anthropic 自研源码控制 Scion，五个月迁出 Git",
      "summary": "Claude 写代码让日合并量从约 2500 涨到 3 万，Git 式工作流成了瓶颈。7 人团队做了 Scion，默认假设客户端是在线 agent 或 CI，而不是人人完整离线 clone。",
      "url": "https://www.anthropic.com/engineering/redesigning-source-control",
      "source": "Anthropic",
      "lens": "模式",
      "origin": "archive_seed"
    },
    {
      "id": "brf-20261014-play-personal-apps",
      "level": "L2",
      "date": "2026-10-14",
      "time": "10-14 01:00",
      "title": "Google Play 上线个人库，vibe-code 的应用可以只装自己手机",
      "summary": "用 AI Studio 做的安卓应用，可以只进自己的 Personal Library，默认私有、不进公开目录和搜索，也不需要开发者账号。先在美国等市场向 18 岁以上用户开放。",
      "url": "https://blog.google/products-and-platforms/platforms/google-play/google-play-updates-october-2026/",
      "source": "GooglePlay",
      "lens": "工具",
      "origin": "archive_seed"
    },
    {
      "id": "brf-20261014-liquid-lfm25",
      "level": "L2",
      "date": "2026-10-14",
      "time": "10-14 01:05",
      "title": "Liquid 开放 LFM2.5-24B-A2B",
      "summary": "24B 总参数、每 token 只激活约 2B，上下文 131K，面向端侧私有 agent。自测 LiveClaw 48.09，高于 Qwen3.6-35B-A3B 的 38.19；知识和软件工程仍弱于更大模型。",
      "url": "https://huggingface.co/blog/LiquidAI/lfm25-24b-a2b",
      "source": "LiquidAI",
      "lens": "工具",
      "origin": "archive_seed"
    },
    {
      "id": "brf-20261014-aa-decision-index",
      "level": "L2",
      "date": "2026-10-14",
      "time": "10-14 00:34",
      "title": "Artificial Analysis 发布 Decision Index v1.0",
      "summary": "专门评「返回结构化选项加概率」的决策模型。发布时 Jev 1.13 以 58 分领先。这类模型在分类和工具调用上接近语言模型，速度和成本有优势，知识与推理明显落后。",
      "url": "https://artificialanalysis.ai/articles/artificial-analysis-decision-index",
      "source": "ArtificialAnlys",
      "lens": "工具",
      "origin": "archive_seed"
    },
    {
      "id": "brf-20261013-anthropic-distillation",
      "level": "L2",
      "date": "2026-10-13",
      "time": "10-13 07:58",
      "title": "Anthropic 的蒸馏防御让 Claude 被盗数据量降 90–99%",
      "summary": "手段包括 preserved thinking 和双阶段分类器。代价是 2026 年 8 月 31 日后新建的 API 账号不能编辑先验上下文，极少数良性请求会被拦并计费。已封禁数万个蒸馏相关账号。",
      "url": "https://www.anthropic.com/research/distillation-defenses",
      "source": "Anthropic",
      "lens": "赛道",
      "origin": "archive_seed"
    },
    {
      "id": "brf-20261013-character-ai-ch11",
      "level": "L2",
      "date": "2026-10-13",
      "time": "10-13 20:23",
      "title": "Character.AI 申请 Chapter 11",
      "summary": "资产与负债都在 5000 万至 1 亿美元区间，已同意向 Disney 出售部分资产约 2000 万美元，目标 11 月底至 12 月初完成。若无买家接手运营，平台会清盘。",
      "url": "https://techcrunch.com/2026/10/13/just-5-years-in-interactive-chatbot-platform-character-ai-files-for-bankruptcy/",
      "source": "TechCrunch",
      "lens": "时机",
      "origin": "archive_seed"
    },
    {
      "id": "brf-20261013-scaledown-langchain",
      "level": "L2",
      "date": "2026-10-13",
      "time": "10-13 20:01",
      "title": "ScaleDown 的决策模型接进 LangChain 与 Deep Agents",
      "summary": "面向摘要、压缩、抽取、分类这类受限输出任务，自带三个中间件。自称窄任务上比前沿模型快约 200 倍、便宜约 467 倍。装 langchain-scaledown 即可用，可选走 LangSmith Gateway。",
      "url": "https://www.langchain.com/blog/building-long-running-agents-with-scaledown-and-deep-agents",
      "source": "LangChain",
      "lens": "工具",
      "origin": "archive_seed"
    },
    {
      "id": "brf-20261013-deepseek-funding-rumor",
      "level": "L2",
      "date": "2026-10-13",
      "time": "10-13 09:29",
      "title": "传闻：DeepSeek 二轮融资金额从约 500 亿增至约 1000 亿元",
      "summary": "《财经》称投前估值仍约 5000 亿元，新老股东拟各占约一半，并称公司加速科创板 IPO。DeepSeek 求证未获回应。属传闻，不能当正式判断。",
      "url": "https://www.mycaijing.com/article/detail/584924?source_id=40",
      "source": "财经",
      "lens": "时机",
      "origin": "archive_seed"
    }
  ]
}
